Bagels,2 @ 6 ea,12 ct,5.49,$0.46,each
Dinner Rolls,1 bag,36 ct,4.49,$0.12,each
Muffins,2 @ 6 ea,12 ct,7.99,$0.67,each
Pretzel Slider Buns,1 bag,16 ct,5.99,$0.37,each
"Agave Nectar, Wholesome! organic",2 @ 36 oz,72 oz,9.99,$0.14,oz
"Almonds, Kirkland Signature, non-pareil",1 bag,3 lbs,12.69,$4.23,lb
"Almonds, Mariani sliced",1 bag,2 lbs,7.99,$4.00,lb
"Baking mix, Bisquick pancake and baking mix",1 box,6 lbs,5.49,$0.06,oz
"Baking mix, Ghirardelli Brownie Triple Chocolate Mix",1 box,120 oz,10.39,$0.09,oz
"Baking mix, Kodiak Power Cakes Flapjack and Waffle mix",1 box,4.5 lbs,11.99,$0.17,oz
"Baking mix, Krusteaz Buttermilk pancake mix",1 box,10 lb,5.99,$0.60,lb
"Baking powder, Red Star",1 container,60 oz,5.39,$0.09,oz
"Baking soda, Arm & Hammer",1 bag,13.5 lb,6.59,$0.49,lb
"Chocolate chips, Nestle Toll House Morsels",1 bag,72 oz,8.99,$0.13,oz
"Flour, all-purpose, Conagra, 25 lbs",1 bag,25 lbs,5.99,$0.24,lb
"Flour, Blue Diamond Almond Flour",1 bag,3 lb,13.69,$4.56,lb
"Flour, Namaste Gluten Free Organic Perfect Blend",1 bag,5 lbs,11.99,$2.40,lb
"Hemp Seeds, Manitoba Harvest Foods raw",1 bag,28 oz,11.99,$0.43,oz
"Pecan halves, Kirkland Signature",1 bag,2 lbs,14.79,$7.40,lb
"Sesame seeds, Rodelle",18 oz,18 oz,4.89,$0.27,oz
"Shortening, Crisco",6 lb,6 lbs,7.69,$1.28,lb
"Sugar, brown, C&H, 25 lbs",1 bag,25 lbs,14.99,$0.60,lb
"Sugar, brown, C&H, pure cane",1 bag,7 lb,4.89,$0.70,lb
"Sugar, granulated, C&H, 10 lbs",1 bag,10 lbs,4.99,$0.50,lb
"Sugar, granulated, C&H, 25 lbs",1 bag,25 lbs,11.99,$0.48,lb
"Sugar, granulated, Kirkland Signature, organic, cane sugar",1 bag,10 lbs,7.99,$0.79,lb
"Sugar, powdered, C&H, 7 lbs",1 bag,7 lbs,4.99,$0.71,lb
"Vanilla, Kirkland Signature",1 bottle,16 oz,23.99,$1.50,oz
"Walnuts, Kirkland Signature",1 bag,3 lbs,10.99,$3.66,lb
"Yeast, Red Star Active Yeast",1 bag,32 oz,4.49,$0.14,oz
"Aloe vera drink, Alo variety",12 @ 16.9 oz,202.8 oz,13.99,$1.17,each
Bai5 Antioxidant Infusions variety,15 @ 18 oz,270 oz,19.99,$1.33,each
"Cocoa, Nesquik Chocolate Powder",41.9 oz,41.9 oz,6.99,$0.17,oz
"Cocoa, Stephen's Milk Chocolate",64 oz,64 oz,8.99,$0.14,oz
"Coconut water, Kirkland Signature",12 @ 11.1 oz,133.2 oz,9.99,$0.83,each
"Coconut water, Vita Coco",12 @ 11.1 oz,133.2 oz,13.99,$1.17,each
"Coke products, 12 oz cans",35 @ 12 oz,384 oz,10.99,$0.31,each
Crystal Light on the Go,44 @ .11 oz,44 ct,7.79,$0.18,each
"Energy drink, 5 Hour Energy",24 @ 1.93 oz,46.32 oz,35.99,$1.50,each
"Energy drink, Kirkland Signature energy shot",48 @ 2 oz,96 oz,34.99,$0.73,each
"Energy drink, Kirkland Signature extra strength energy shot",48 @ 2 oz,96 oz,38.99,$0.81,each
"Energy drink, Monster",24 @ 16 oz,384 oz,32.99,$1.38,each
"Energy drink, Red Bull",24 @ 8.4 oz,201.6 oz,35.99,$1.50,each
Gatorade Fierce variety pack,35 @ 16.9 oz,591.5 oz,15.99,$0.46,each
Gatorade Frost variety pack,35 @ 16.9 oz,591.5 oz,15.99,$0.46,each
Gatorade G2 variety pack,35 @ 16.9 oz,591.5 oz,15.99,$0.46,each
Gatorade variety Allstars,28 @ 12 oz,336 oz,12.99,$0.46,each
Gatorade variety pack,35 @ 16.9 oz,591.5 oz,15.99,$0.46,each
Glaceau Vitamin Water Variety,20 @ 20 oz,400 oz,15.99,$0.80,each
"Honest Kids Organic, variety",40 @ 6 oz,240 oz,9.99,$0.25,each
Izze,24 @ 8.4 oz,201.6 oz,14.79,$0.62,each
"Juice, Capri-Sun 100% Juice Variety",40 @ 6oz,240 oz,9.99,$0.25,each
"Juice, Capri-Sun 10% Juice Variety",40 @ 6oz,240 oz,7.89,$0.20,each
"Juice, Kern's Nectar Variety Pack",30 @ 11.5 oz,345 oz,13.59,$0.45,each
"Juice, Kirkland Signature Cranberry",2 @ 96 oz,192 oz,5.79,$0.03,oz
"Juice, Kirkland Signature Cranberry-Raspberry",2 @ 96 oz,192 oz,5.99,$0.03,oz
"Juice, Kirkland Signature Fresh Pressed Apple",2 @ 128 oz,256 oz,7.89,$0.03,oz
"Juice, Kirkland Signature Newman's Grape Juice",2 @ 96 oz,192 oz,6.69,$0.04,oz
"Juice, Kirkland Signature variety, 100% juice, organic",40 @ 6.75 oz,270 oz,12.79,$0.32,each
"Juice, Langers Mango Nectar",128 oz,128 oz,5.89,$0.05,oz
"Juice, Martinelli's Sparkling Cider",4 @ 25.4 oz,100.6 oz,8.49,$2.12,each
"Juice, Tree Top Apple Juice",2 @ 128 oz,256 oz,7.49,$0.03,oz
"Juice, Tropicana Orange",24 @ 10 oz,240 oz,13.39,$0.06,"oz,"
"Juice, V-8 100% Vegetable Juice",28 @ 11.5 oz,322 oz,13.99,$0.50,each
Kirkland Signature Sparkling Flavored Water Variety,24 @ 17oz,408 oz,8.99,$0.38,each
Kirkland Signature Vitarain Zero Variety,24 @ 20 oz,480 oz,9.99,$0.42,each
"Non-Dairy Milk, Blue Diamond Vanilla Almond Breeze",6 @ 32 oz,192 oz,8.99,$0.05,oz
"Non-Dairy Milk, Kirkland Signature Organic Almond unsweetened",6 @ 32 oz,192 oz,8.49,$0.04,oz
"Non-Dairy Milk, Kirkland Signature Organic Soy",12 @ 32 oz,384 oz,13.99,$0.04,oz
"Pepsi products, 12 oz cans",36 @ 12 oz,432 oz,9.99,$0.28,each
Propel Zero Fitness Water Variety,24 @ 16.9 oz,405.6 oz,9.99,$0.42,each
Snapple Diet Tea Variety,24 @ 20 oz,480 oz,17.59,$0.73,each
Starbucks Frappuccino,15 @ 9.5 oz,142.5 oz,17.59,$1.17,each
Sunny Delight Big D Sports Cap,24 @ 11.3 oz,271.2 oz,10.39,$0.43,each
Talking Rain Sparkling variety,30 @ 16.9 oz,507,9.99,$0.33,each
Talking Rain Sparkling Ice Variety Pack,18 @ 17 oz,306 oz,10.99,$0.61,each
"Water, Arrowhead Spring",40 @ 16.9 oz,676 oz,4.99,$0.13,each
"Water, Arrowhead Spring Sport Top",24 @ 23.7 oz,568.8 oz,4.89,$0.20,each
"Water, Glaceau Smartwater",15 @ 1 liter,15 l,14.99,$1,each
"Water, Kirkland Signature Drinking Water",21 @ 1 liter,21 l,3.99,$0.19,each
"Water, Kirkland Signature Premium",40 @ 16.9 oz,676 oz,2.99,$0.07,each
"Water, Kirkland Signature Premium",80 @ 8 oz,640 oz,6.99,$0.10,each
"Water, Perrier Sparkling Mineral",24 @ .5l,12 l,16.99,$0.71,each
"Water, San Pellegrino Sparkling Mineral",15 @ 25.3 oz,379.5 oz,16.99,$1.13,each
"Butter, I Can't Believe it's not Butter",2 @ 45oz,90 oz,8.99,$0.10,oz
"Butter, Kerrygold Salted Butter",1.5 lbs,1.5 lbs,7.69,$5.13,lb
"Butter, Kirkland Signature Butter Quarters",4 @ 1 lb,4 lbs,9.99,$2.50,lb
"Butter, Kirkland Signature Organic Butter Quarters",2 @ 1 lb,2 lbs,7.99,$4.00,lb
"Butter, Kirkland Signature Salted Butter Solids",4 @ 1lbs,4 lbs,9.89,$2.50,lb
"Cheese, Babybel, mini bel kaukauna (reg. or light)",32 @ .75 oz,24 oz,10.99,$0.39,each
"Cheese, Bandon Medium Cheddar",1 loaf,2.5 lbs,6.99,$2.80,lb
"Cheese, Beecher's Flagship",varies,varies,varies,$8.89,lb
"Cheese, Belgioioso, Crumbled Gorgonzola",24 oz,24 oz,7.49,$4.99,lb
"Cheese, Belgioioso, Mild Provolone",1 container,2 lbs,7.89,$3.95,lb
"Cheese, Belgioioso, Sliced Mozzarella logs",2 @ 1 lb,2 lbs,7.79,$3.90,lb
"Cheese, Boursin",3 @ 5.2 oz,15.6 oz,8.99,$0.58,oz
"Cheese, Darigold Cottage",3 lbs,3 lbs,4.99,$1.66,lb
"Cheese, Darigold Sharp Cheddar",2 @ 1.5 lbs,3 lbs,8.39,$2.80,lb
"Cheese, Dofino Sliced Havarti",2 lbs,2 lbs,7.99,$4.00,lb
"Cheese, Finlandia, Four Cheese Variety",2 lbs,2 lbs,8.69,$4.35,lb
"Cheese, Finlandia, Reduced Fat Variety",2 lbs,2 lbs,7.99,$4.00,lb
"Cheese, Frigo Mozzarella Loaf",1 loaf,2 lbs,4.99,$2.50,lb
"Cheese, Frigo String Cheese",60 ct @ 1 oz,60 oz,10.49,$0.18,each
"Cheese, Galbani Shredded Parmesan",3 lbs,3 lb,10.99,$3.66,lb
"Cheese, Gruyere, imported Switzerland",varies,varies,varies,$10.89,lb
"Cheese, Kerrygold Dubliner",varies,varies,varies,$5.89,lb
"Cheese, Kirkland Signature American Blue Cheese",varies,varies,varies,$4.69,lb
"Cheese, Kirkland Signature American singles",120 ct,5 lb,10.99,$0.09,each
"Cheese, Kirkland Signature, Goat",2 @ 10.5 oz,21 oz,6.79,$0.32,oz
"Cheese, Kirkland Signature, Cheddar Jack, shredded",2 @ 2.5lb,5 lbs,13.69,$2.74,lb
"Cheese, Kirkland Signature, French Comte",17.6 oz,17.6 oz,8.59,$0.49,lb
"Cheese, Kirkland Signature, Italian Pecorino Romano",varies,varies,varies,$6.69,lb
"Cheese, Kirkland Signature, Medium Cheddar, shredded",2 @ 2.5 lb,5 lbs,15.99,$3.20,lb
"Cheese, Kirkland Signature, Mild Cheddar, block",2 lbs,2 lbs,4.99,$2.50,lb
"Cheese, Kirkland Signature, Mild Cheddar, block",5 lbs,5 lbs,12.99,$2.60,lb
"Cheese, Kirkland Signature, Mild Cheddar, shredded",2 @ 2.5 lbs,5 lbs,13.69,$2.74,lb
"Cheese, Kirkland Signature, Mexican Blend, shredded",2 @ 1.5lb,3 lbs,8.59,$2.86,lb
"Cheese, Kirkland Signature, Parmigiano Reggiano, shredded",1 tub,1 lb,11.49,$11.49,lb
"Cheese, Kirkland Signature, Reggiano Stravecchio",varies,varies,10.49,$10.49,lb
"Cheese, Kirkland Signature Sharp Cheddar",5 lb,5 lbs,11.99,$2.40,lb
"Cheese, Kolios Organic Greek Feta",16 oz,16 oz,6.89,$0.43,oz
"Cheese, Kraft American singles",96 ct,4 lbs,9.99,$0.10,each
"Cheese, Laughing Cow",4 @ 6 oz,24 oz,7.99,$0.25,oz
"Cheese, Organic Creamery Sharp Cheddar, organic",varies,varies,varies,$7.99,lb
"Cheese, President Brie",varies,varies,varies,$4.99,lb
"Cheese, President Feta",1 container,per lb,per lb,$3.69,lb
"Cheese, Sargento Balanced Breaks",12 @ 1.5 oz,18 oz,8.99,$0.75,each
"Cheese, Tillamook 3 Year Reserve Cheddar",18 oz,18 oz,6.79,$0.38,oz
"Cheese, Tillamook Colby and Jack, sliced",1 bag,2 lbs,7.99,$3.99,lb
"Cheese, Tillamook Colby Jack",1 loaf,2.5 lbs,7.99,$3.20,lb
"Cheese, Tillamook Extra Sharp Cheddar",1 loaf,2 lbs,9.59,$4.80,lb
"Cheese, Tillamook Extra Sharp White Cheddar",1 loaf,2 lbs,10.79,$5.40,lb
"Cheese, Tillamook Medium Cheddar, sliced",1 bag,2.5 lbs,9.69,$3.88,lb
"Cheese, Tillamook Pepper Jack",1 loaf,2.5 lbs,7.99,$3.20,lb
"Cheese, Tillamook Sharp Cheddar, block",2.5 lbs,2.5 lbs,8.99,$3.60,lb
"Cheese, Tillamook Spicy Combo, sliced",1 bag,2 lbs,7.99,$4.00,lb
"Cheese, Tillamook Swiss, sliced",1 pkg,2 lbs,8.99,$4.50,lb
"Cream Cheese, Philadelphia",1 container,3 lbs,8.39,$2.80,lb
"Cream Cheese, Philadelphia, single serving",1 box,50 ct,9.99,$0.20,each
"Cream Cheese, Raskas",1 loaf,3 lbs,5.99,$2.00,lb
"Creamer, Coffee-Mate French Vanilla",2 @ 56 oz,112 oz,7.99,$0.07,oz
"Eggs, Kirkland Signature 100% Egg Whites",6 @ 16 oz,96 oz,7.99,$0.08,oz
"Eggs, Wilcox, organic large",24 ct,24 ct,6.39,$3.20,dozen
"Eggs, Wilcox, Extra Large",24ct,24ct,3.49,$1.75,dozen
"Eggs, Wilcox, Large",60 ct,60 ct,6.49,$1.30,dozen
"Eggs, Wilcox, Large brown omega 3",18 ct,18 ct,4.49,$2.99,dozen
"Eggs, Wilcox, organic, hard boiled and peeled",24 ct,24 ct,9.59,$0.40,each
"Milk, Darigold, whole, chocolate milk",1 carton,64 oz,3.29,$0.05,oz
"Milk, Darigold, 1%, chocolate milk",18 @ 8 oz,144 oz,9.59,$0.10,oz
"Milk, Darigold, half and half",1/2 gallon,1/2 gallon,3.49,$0.05,oz
"Milk, Darigold, heavy whipping cream",1/2 gallon,1/2 gallon,8.49,$0.14,oz
"Milk, Kirkland Signature, 1% low-fat",2 @ 1 gallon,2 gallons,4.39,$1.20,gallon
"Milk, Kirkland Signature, 2%, lactose free",3 @ 64 oz,192 oz,6.99,$0.04,oz
"Milk, Kirkland Signature, 2%, organic",3 @ 64 oz,192 oz,11.59,$0.06,oz
"Milk, Kirkland Signature, 2% reduced-fat",2 @ 1 gallon,2 gallons,4.79,$2.40,gallon
"Milk, Kirkland Signature, whole",2 @ 1 gallon,2 gallons,5.29,$2.65,gallon
"Milk, Silk Almond Milk Original",3 @ 64 oz,192 oz,7.59,$0.04,oz
"Sour Cream, Darigold All Natural",1 container,3 lbs,3.99,$1.33,lb
"Whipped Cream, Land o Lakes",3 @ 14 oz,42 oz,8.99,$3,each
"Yogurt, Chobani Greek, variety",20 @ 5.3 oz,106 oz,14.99,$0.75,each
"Yogurt, Dannon Activia Probiotic",24 @ 4 oz,96 oz,9.99,$0.42,each
"Yogurt, Dannon Light and Fit Greek",18 @ 5.3 oz,95.4 oz,12.99,$0.72,each
"Yogurt, Fage Greek Nonfat",1 tub,48 oz,5.6,$0.12,oz
"Yogurt, Kirkland Signature Greek Non-fat",2 @ 32 oz,64 oz,5.99,$0.09,oz
"Yogurt, Yoplait Go-Gurt",32 @ 2.25oz,72 oz,7.89,$0.25,each
"Yogurt, Yoplait Variety Pack, Light",24 ct @ 6 oz,144 oz,9.99,$0.42,each
"Bagel Bites, Ore-Ida",1 bag,72 ct,9.99,$0.14,each
"Beef, ground, Kirkland Signature 91% lean",5 @ 1 lb,5 lbs,15.99,$3.20,lb
"Beef patties, Kirkland Signature ground beef",24 ct,6 lbs,15.99,$2.67,lb
"Beef patties, Kirkland Signature sirloin",18 ct,6 lbs,17.99,$3.00,lb
"Beef patties, Quick'N Eat Angus Choice",12 ct,3 lb,14.99,$5.00,lb
"Black bean burgers, Morningstar Farms chipotle",12 ct,50.4 oz,14.79,$1.23,each
"Blueberries, Kirkland Signature",1 bag,5 lbs,7.49,$1.50,lb
"Blueberries, Kirkland Signature organic",1 bag,3 lbs,10.79,$3.60,lb
"Bread, Udi's Gluten Free",1 loaf,30 oz,6.99,$0.23,oz
"Breakfast turkey sandwich, Jimmy Dean",1 box,12 ct,11.99,$1.00,each
"Broccoli, Purely Frozen Organic",4 bags,4 lbs,7.59,$1.90,lb
"Buffalo chicken rolls, Coyote Grill",1 box,34 oz,8.99,$0.26,oz
"Burritos, Don Miguel Chicken and Cheese",1 box,12 ct,11.69,$0.97,each
"Burritos, El Monterey Variety",1 box,30 ct,14.99,$0.50,each
"Cheeseburgers, Pierre Signatures",1 box,8 ct,13.49,$1.69,each
"Cherries, Moov organic",1 bag,3 lbs,8.99,$3.00,lb
"Chicken Bakes, Kirkland Signature",6 @ 8 oz,3 lbs,10.99,$1.83,each
"Chicken Cordon Bleu, Pierre",6 @ 6.5 oz,39 oz,13.69,$2.28,each
"Chicken, Breasts, Boneless, Skinless",1 bag,6.5 lbs,16.79,$2.58,lb
"Chicken, Breasts, Boneless, Skinless",1 bag,10 lbs,21.49,$2.15,lb
"Chicken, Breasts, Grilled Foster Farms Strips",1 bag,3.25 lbs,13.99,$4.31,lb
"Chicken, Foster Farms Boneless Buffalo Bites",1 bag,3.5 lb,11.99,$3.43,lb
"Chicken, Nuggets, Dino Buddies",1 bag,5 lbs,11.89,$2.38,lb
"Chicken, Nuggets, Perdue Panko",1 bag,5 lbs,11.89,$2.38,lb
"Chicken, Patties, Don Lee Farms grilled",12 @ 3.5oz,2.5 lbs,14.99,$6.00,lb
"Chicken, Patties, Foster Farms",5 lbs,5 lbs,13.79,$2.76,lb
"Chicken, Tenders, Kirkland Signature",1 bag,6 lbs,15.99,$2.67,lb
"Chicken, Tenders, Tyson, breaded",1 bag,5 lbs,13.99,$2.80,lb
"Chicken, Thighs, Boneless, Skinless, Kirkland Signature",1 bag,6.5 lbs,12.99,$2.00,lb
"Chicken, Wings, Foster Farms Cracked Pepper",1 bag,5 lbs,15.49,$3.10,lb
"Chicken, Wings, Foster Farms Honey BBQ",1 bag,5 lbs,15.49,$3.10,lb
"Chicken, Wings, Foster Farms Hot 'N Spicy",1 bag,5 lbs,15.49,$3.10,lb
"Chicken, Wings, Kirkland Signature",1 bag,10 lbs,19.99,$2.00,lb
"Chimichangas, Posada Steak",1 box,18 @ 5 oz,13.89,$0.77,each
"Cod, Kirkland Signature Wild Alaskan",1 bag,2 lbs,14.99,$7.50,lb
"Cod, Trident Beer Batter",1 bag,2.5 lbs,12.79,$5.12,lb
"Corn, Flav-R-Pac Organic White",1 bag,5 lbs,6.79,$1.36,lb
"Corn Dogs, Foster Farms Chicken",28 @ 4 oz,112 oz,9.99,$0.36,each
"Cream puffs, Delizza mini",100 ct,44 oz,8.79,$0.09,each
"Creamy chicken and rice, Milton's",2 @ 38 oz,76 oz,13.99,$2.95,lb
"Egg rolls, Minh, pork",20 @ 3 oz,60 oz,7.59,$2.02,lb
"Fish sticks, Trident",1 box,4 lbs,11.99,$3.00,lb
"Fruit, Kirkland Signature 3 Berry Blend",1 bag,4 lb,8.99,$2.25,lb
"Fruit, Rader Farms Fresh Start Smoothie blend, organic",6 @ 8 oz,48 oz,11.99,$4.00,lb
"Fruit, Sunrise Growers antioxidant blend, organic",1 bag,3 lbs,9.99,$3.33,lb
"Fruit, Wawona Festival",1 bag,6 lbs,10.99,$1.83,lb
"Green Beans, Maas River Farms Organic",1 bag,5 lbs,7.29,$1.49,lb
"Hot Pockets, Bacon egg and cheese",1 box,17 @ 4.5oz,11.99,$0.71,each
"Hot Pockets, Pepperoni pizza",1 box,17 @ 4.5 oz,11.99,$0.71,each
"Ice cream, Haagen Dazs vanilla almond bars",15 @ 3oz,45 oz,12.49,$0.83,each
"Ice cream, Healthy Choice Fudge Bars",18 @ 3 oz,54 oz,11.89,$0.66,each
"Ice cream, Kirkland Signature, Vanilla",2 @ .5 gallon,1 gallon,11.99,$0.09,oz
"Lasagna, Kirkland Signature beef",2 @ 3 lbs,6 lbs,11.99,$2.00,lb
"Lasagna, Kirkland Signature sausage and beef",2 @ 3 lbs,6 lbs,12.69,$2.12,lb
"Mahi Mahi, Kirkland Signature, wild pacific",1 bag,3 lbs,23.99,$8.00,lb
"Mandarin Orange Chicken, Crazy Cuisine",1 box,66 oz,14.99,$0.23,oz
"Mango, Moov organic",1 bag,4 lbs,9.29,$2.32,lb
"Meatballs, Kirkland Signature Italian Style",1 bag,6 lbs,16.99,$2.83,lb
"Mozzarella sticks, Petite Cuisine",1 box,5 lbs,13.49,$0.17,oz
"Orange Juice, Sunshine",6 @ 16 oz,96 oz,11.49,$0.12,oz
"Peas, Flav-R-Pac organic",1 bag,5 lb,6.79,$1.36,lb
"Philly cheese steak, Raybern",6 @ 5.6 oz,33.6 oz,11.99,$0.36,oz
"Pita melt, Sandwich Brothers",15 @ 2.5 oz,37.5 oz,10.99,$0.29,oz
"Pizza, Kirkland Signature cheese",4 ct,4 ct,9.99,$0.15,oz
"Pizza, Kirkland Signature thin crust pepperoni",4 ct,4 ct,11.49,$0.16,oz
"Pizza, Sabatasso's Gluten Free",3 ct,3 ct,15.99,$5.33,each
"Pizza, Sabatasso's Single Pizza Variety",12 ct,12 ct,9.99,$0.83,each
"Pizza, Sonoma Gluten Free BBQ Chicken",2 @ 19 oz,2 ct,13.49,$0.36,oz
"Pot Pie, Marie Callender's chicken",8 ct,8 ct,11.59,$0.15,"oz,"
"Pot Stickers, Ling Ling All Natural",4.2 lbs,4.2 lbs,10.69,$2.52,lb
"Quiche, Kellogg's Crustless",8 ct,8 ct,11.69,$1.46,each
"Ravioli, Pasta Prima",1 bag,3.5 lbs,9.99,$2.85,lb
"Salmon, Copper River Seafoods Wild Alaskan marinated",1 bag,2.25 lbs,15.69,$6.97,lb
"Salmon, Kirkland Signature Wild Sockeye",1 bag,3 lbs,28.99,$9.66,lb
"Salmon, Kirkland Signature, Atlantic, farmed",1 bag,3 lbs,24.99,$8.33,lb
"Salmon, Trident Wild Salmon Burgers",12 ct,3 lbs,15.99,$5.33,lb
"Sausage Patties, MorningStar",32 ct,32 ct,13.99,$0.44,each
"Sausage Patties, Tyson all natural",4 lbs,4 lbs,12.99,$3.25,lb
"Shrimp, Kirkland Signature, 21/25 ct, Raw, Farm Raised",1 bag,2 lbs,17.79,$8.90,lb
"Shrimp, Kirkland Signature, 31/40 ct Raw, Farm Raised",1 bag,2 lbs,13.99,$7,lb
"Shrimp, Kirkland Signature, 31/40 ct, Cooked, Farm Raised",1 bag,2 lbs,15.99,$8.00,lb
"Shrimp, Kirkland Signature, 50/70 Cooked, Farm Raised",1 bag,2 lbs,14.99,$7.50,lb
"Shrimp, Kirkland Signature, Panko Butterfly",1 bag,2.5 lbs,19.99,$8.00,lb
"Spring Rolls, Royal Asia vegetable",1 box,48 oz,9.99,$0.21,oz
"Strawberries, Kirkland Signature, whole",1 bag,6 lbs,10.99,$1.83,lb
"Tamales, Nuevo Grill Handmade Beef",10 @ 5 oz,50 oz,11.59,$0.23,oz
"Taquitos, Delimex Beef",50 @ 1.2 oz,60 oz,11.99,$0.24,each
"Teriyaki Bowls, Oven Roasted Chicken",6 @ 12.5 oz,75 oz,10.99,$1.83,each
"Tilapia, Kirkland Signature, loins, farmed",1 bag,2.5 lbs,13.99,$5.60,lb
"Tilapia, Trident Panko Breaded",1 bag,3 lbs,12.99,$4.33,lb
"Turkey, Kirkland Signature Patties",12 ct,4 lbs,10.99,$2.75,lb
"Uncrustables, Smuckers peanut butter and grape",18 @ 2.8 oz,50.4 oz,10.99,$0.22,"oz,"
"Vegetables, Kirkland Signature Stir Fry, organic",1 bag,5.5 lbs,7.39,$1.34,lb
"Vegetables, Kirkland Signature Normandy, organic",1 bag,5.5 lbs,8.79,$1.60,lb
"Veggie burgers, Morningstar Farms",1 box,16 @ 13.5 oz,12.89,$0.23,oz
"Waffles, Kellogg's Eggo Homestyle",1 box,72 ct,9.99,$0.14,each
Yakisoba Stir Fry,6 @ 9oz,54 oz,11.49,$3.40,lb
A-1 Steak Sauce,4 @ 10oz,40 oz,9.79,$0.25,oz
"Almond Butter, Kirkland Signature",27 oz,27 oz,7.99,$0.30,oz
"Almonds, Blue Diamond Smokehouse",1 bag,38 oz,14.69,$6.19,lb
"Almonds, Kirkland Signature, dry roasted",1 bag,2.5 lbs,10.99,$4.40,lb
"Almonds, Kirkland Signature, marcona",1 bag,17.63 oz,12.99,$11.79,lb
"Applesauce, Treetop, organic",4 @ 47.25oz,189 oz,8.39,$0.04,oz
"Avocado oil, Chosen Foods",1 bottle,1 liter,9.79,$9.79,liter
"Bacon crumbles, Kirkland Signature",20 oz,20 oz,9.99,$0.50,oz
"Balsamic vinegar, Kirkland Signature",1 bottle,1 liter,10.99,$0.33,oz
"Barbecue Sauce, Sweet Baby Ray's",2 @ 40oz,80 oz,5.59,$0.07,oz
"Bars, Belvita Breakfast Biscuit",1 box,25 ct,10.59,$0.42,each
"Bars, Caveman Dark Chocolate Variety",1 box,20 ct,17.99,$0.90,each
"Bars, Clif Bar Organic Nut Filled",1 box,18 ct,19.89,$1.11,each
"Bars, Clif Bar Organic Zbar variety",1 box,36 ct,17.49,$0.49,each
"Bars, Clif Bar Variety Pack",1 box,24 ct,19.89,$0.83,each
"Bars, Fiber One Oats and Chocolate",1 box,36 ct,10.99,$0.31,each
"Bars, Kashi Chocolate Almond Sea Salt",1 box,35 ct,12.79,$0.37,each
"Bars, Kirkland Signature Nut Bars",1 box,30 ct,16.99,$0.57,each
"Bars, Kirkland Signature Soft and Chewy Granola",1 box,60 ct,8.79,$0.15,each
"Bars, Nature's Bakery Fig Bars",1 box,36 ct,11.59,$0.32,each
"Bars, Nature Valley Chewy Trail Mix Bars",1 box,48 ct,12.79,$0.27,each
"Bars, Nature Valley Oats 'N Honey Granola 2 Bar Pouches",1 box,49 ct,12.79,$0.26,each
"Bars, Nature Valley Protein Chewy",1 box,30 ct,13.69,$0.46,each
"Bars, Nature Valley Sweet & Salty",1 box,48 ct,12.79,$0.27,each
"Bars, Nugo Nutrition Bars, variety",1 box,24 ct,18.49,$0.77,each
"Bars, Nutri-Grain Cereal Bar",1 box,48 ct,12.49,$0.26,each
"Bars, Premier Protein protein bars, variety",1 box,22 ct,14.99,$0.68,each
"Bars, Pure Protein",1 box,21 ct,18.99,$0.91,each
"Bars, Quaker Chewy Granola Variety",1 box,60 ct,8.89,$0.15,each
"Bars, Zone Perfect",1 box,24 ct,16.99,$0.71,each
"Bread, Dave's Killer Organic",2 @ 27 oz,54 oz,7.59,$0.14,"oz,"
"Bread, Dave's Killer Organic Powerseed Thin",2 @ 24 oz,48 oz,7.59,$0.16,"oz,"
"Bread, Dave's Killer Organic Sprouted",2 @ 22 oz,44 oz,7.59,$0.17,"oz,"
"Bread, Essential Baking Organic Sourdough",3 @ 18.2 oz,54.6 oz,7.99,$0.15,"oz,"
"Bread, Franz Brioche Hamburger Buns",12 ct,12 ct,3.59,$0.30,each
"Bread, Franz Giant White",2 @ 32 oz,64 oz,3.99,$0.06,"oz,"
"Bread, Franz Gluten Free Whole Grain White",2 @ 20 oz,40 oz,8.99,$0.23,"oz,"
"Bread, Franz, Great Seed Organic",2 @ 26 oz,52 oz,6.49,$0.13,"oz,"
"Bread, Hamburger Buns, sesame",24 ct,24 ct,3.89,$0.16,each
"Bread, Hot Dog Buns",24 ct,24 ct,3.29,$0.14,each
"Bread, Kirkland Signature Multigrain",2 @ 28 oz,56 oz,4.39,$0.08,"oz,"
"Bread, Kirkland Signature Raisin",2 @ 24 oz,48 oz,6.59,$0.14,"oz,"
"Bread, Kirkland Signature Sandwich Rolls",18 ct,18 ct,3.49,$0.19,each
"Bread, Kirkland Signature Split Top Wheat",2 @ 32 oz,64 oz,3.99,$0.06,"oz,"
"Bread, Milton's Multigrain Muffins",12 ct,12 ct,3.99,$0.33,each
"Bread, Ol Time White Bread",2 ct,2 ct,2.99,$1.50,each
"Bread, Oroweat 100% Whole Wheat",2 @ 32 oz,64 oz,5.79,$0.09,"oz,"
"Bread, Oroweat 100% Whole Wheat Sandwich Thins",24 ct,24 ct,5.99,$0.25,each
"Bread, Oroweat All Natural Buttermilk",2 @ 32,64 oz,5.79,$0.09,oz
"Bread, Oroweat Oatnut",2 @ 32 oz,64 oz,5.79,$0.09,"oz,"
"Bread, Portland French Pub Bun",12 ct,12 ct,3.99,$0.33,each
"Bread, Portland French Sourdough",32 oz,32 oz,3.79,$0.12,oz
"Bread, Thomas English Muffins",24 ct,24 ct,6.79,$0.28,each
"Breakfast Essentials, Carnation",1 box,40 ct,12.59,$0.25,oz
"Broth, Organic Better than Bouillon 16 oz, Beef, organic",1 jar,16 oz,6.39,$0.40,oz
"Broth, Organic Better than Bouillon 16 oz, Chicken, organic",1 jar,16 oz,5.99,$0.37,oz
"Cashews, Kirkland Signature",1 jar,2.5 lb,18.99,$7.60,lb
"Candy, Black Forest Gummy Bears",1 bag,6 lbs,8.69,$1.45,lb
"Candy, Brookside Dark Chocolate Acai Blueberry",1 bag,32 oz,9.99,$0.31,oz
"Candy, Hershey Nestle M&M All Chocolate Bag",90 oz,90 oz,16.49,$2.93,lb
"Candy, Hi Chew Fruit Chews",30 oz,30 oz,8.59,$0.29,oz
"Candy, Kirkland Signature Chocolate Caramel Macadamia Clusters",1 jar,2 lb,13.99,$6.99,lb
"Candy, Kirkland Signature Chocolate Raisins",1 jar,54 oz,9.99,$2.96,lb
"Candy, Kirkland Signature Dark Chocolate Almonds",1 jar,32 oz,9.49,$0.30,oz
"Candy, Kirkland Signature Dark Chocolate Mangos",1 jar,19.4 oz,8.99,$0.46,oz
"Candy, Kirkland Signature Funhouse Treats",5.75 lbs,5.75 lbs,13.99,$2.43,lb
"Candy, Kirkland Signature Gourmet Jelly Beans",1 jar,64 oz,13.99,$3.50,lb
"Candy, Kirkland Signature Milk Chocolate Almonds",1 jar,3 lbs,11.99,$4.00,lb
"Candy, Kirkland Signature Mini Chocolate Variety",5 lbs,5 lbs,15.99,$3.20,lb
"Candy, Lemoncello Almonds",24 oz,24 oz,8.99,$0.38,oz
"Candy, M&M Mars Plain Peanut Chocolate",56 oz,56 oz,8.99,$2.60,lb
"Candy, Mark Avenue Dark Chocolate Coconut Almonds",1 jar,32 oz,9.69,$4.85,lb
"Candy, Red Vines, American Licorice",1 bucket,5.5 lbs,8.99,$1.60,lb
"Canned, Artichokes, whole in oil, Kirkland Signature",2 @ 33 oz,66 oz,10.79,$0.16,oz
"Canned, Baked Beans, Bush's Original",6 @ 28 oz,168 oz,10.49,$0.06,"oz,"
"Canned, Black Beans, S&W organic",8 @ 15 oz,120 oz,6.79,$0.06,"oz,"
"Canned, Chunk Chicken Breast, Kirkland Signature",6 @ 12.5 oz,75 oz,9.99,$0.13,"oz,"
"Canned, Clams, Seawatch chopped",2 @ 51 oz,102 oz,17.99,$0.18,oz
"Canned, Corn, Kirkland Signature",12 @ 15 oz,180 oz,6.99,$0.04,"oz,"
"Canned, Fruit Cocktail, S & W",8 @ 15 oz,120 oz,9.99,$0.08,"oz,"
"Canned, Green Beans, Kirkland Signature",12 @ 14.5 oz,174 oz,7.69,$0.04,"oz,"
"Canned, Kidney Beans, S&W organic",8 @ 15.25 oz,122 oz,7.39,$0.06,"oz,"
"Canned, Mushrooms, Festival organic",12 @ 4 oz,48 oz,9.59,$0.20,"oz,"
"Canned, Pulled Pork, Harvest Creek",4 @ 12 oz,48 oz,6.99,$0.15,"oz,"
"Canned, Roast Beef, Kirkland Signature",4 @ 12 oz,48 oz,12.99,$0.27,"oz,"
"Canned, Salmon, Kirkland Signature, Wild Pink",6 @ 6 oz,36 oz,12.99,$0.36,"oz,"
"Canned, Salmon, Kirkland Signature, Wild Sockeye",3 @ 6 oz,18 oz,10.89,$0.60,"oz,"
"Canned, Sardines, in olive oil",6 @ 4.375 oz,26.25 oz,9.99,$0.38,"oz,"
"Canned, Spam, 25% less sodium",8 @ 12 oz,96 oz,19.99,$0.21,oz
"Canned, Tomatoes, paste, Kirkland Signature organic",12 @ 6oz,72 oz,6.79,$0.09,"oz,"
"Canned, Tomatoes, sauce, Kirkland Signature organic",12 @ 15oz,180 oz,7.99,$0.04,"oz,"
"Canned, Tomatoes, sliced and stewed, Kirkland Signature, organic",8 @ 14.5 oz,116 oz,6.49,$0.06,"oz,"
"Canned, Tuna, Chicken of the Sea solid white albacore in water",8 @ 7 oz,56 oz,12.99,$0.23,"oz,"
"Canned, Tuna, Kirkland Signature chunk light skip jack tuna in water",12 @ 7 oz,84 oz,13.49,$0.16,"oz,"
"Canned, Tuna, Kirkland Signature solid white albacore in water",8 @ 7 oz,56 oz,12.99,$0.23,"oz,"
"Canned, Tuna, Wild Planet Albacore Pole and Troll Caught",6 @ 5 oz,30 oz,14.99,$0.50,"oz,"
"Canned, Vienna Sausage, Libby's",18 @ 4.6 oz,82.8 oz,7.99,$0.44,can
"Canola oil, Kirkland Signature",2 @ 3 qts,1.5 gal,8.49,$1.42,qt
"Canola oil, Kirkland Signature cooking spray",2 @ 17 oz,34 oz,4.99,$0.15,oz
"Cereal, Annie's Organic Cocoa Bunnies",27.25 oz,27.25 oz,7.89,$0.29,oz
"Cereal, Cinnamon Toast Crunch",2 bags,49.5 oz,6.99,$0.14,oz
"Cereal, General Mills Cheerios",2 boxes,40.7 oz,6.39,$0.16,oz
"Cereal, General Mills Honey Nut Cheerios",1 box,55 oz,7.99,$0.15,oz
"Cereal, General Mills Lucky Charms",1 box,46 oz,7.29,$0.16,oz
"Cereal, General Mills Multi Grain Cheerios",2 boxes,37.5 oz,6.99,$0.19,oz
"Cereal, Kashi Go-Lean Crunch",1 box,51 oz,5.99,$0.12,oz
"Cereal, Kellogg's Frosted Flakes",1 box,61.9 oz,7.59,$0.12,oz
"Cereal, Kellogg's Frosted Mini Wheats",2 bags,70 oz,8.69,$0.12,oz
"Cereal, Kellogg's Raisin Bran",2 bags,76.5 oz,8.49,$0.11,oz
"Cereal, Kellogg's Special K Red Berries",1 box,43 oz,8.99,$0.21,oz
"Cereal, Kirkland Signature Organic Ancient Grains",1 bag,35.3 oz,6.99,$0.21,oz
